<?xml version="1.0" encoding="UTF-8"?>
<Book xmlns:xsi="http://www.w3.org/2001/XMLSchema-instance"
xsi:noNamespaceSchemaLocation="book17.xsd">
      <Title>Copia este libro</Title>
      <Author>
            <Name>David Bravo</Name>
      </Author>
      <Ilustrator>
            <Name>Pablo Soto</Name>
            <Awards>15m</Awards>
            <Awards>Sinde</Awards>
      </Ilustrator>
</Book>